{
  "id": "x402-evm-eip3009-not-yet-valid-001",
  "schema_version": "3.0.0",
  "protocol": "x402",
  "scheme": "exact",
  "network": "eip155:84532",
  "asset_transfer_method": "eip3009",
  "encodes": "Not yet valid: verification occurs before validAfter.",
  "provenance": [
    "EIP-3009"
  ],
  "description": "The authorization is signed correctly but its validAfter is after the verification time, so the mandate is not yet valid.",
  "input": {
    "x402Version": 2,
    "payload": {
      "authorization": {
        "from": "0xf39Fd6e51aad88F6F4ce6aB8827279cffFb92266",
        "to": "0x70997970C51812dc3A010C7d01b50e0d17dc79C8",
        "value": "10000",
        "validAfter": "1740672120",
        "validBefore": "1740672180",
        "nonce": "0x0202020202020202020202020202020202020202020202020202020202020202"
      },
      "signature": "0x6d97fa04e63d458190789542762da22aa56cb9058fde09743f6e1c5e2758ce6e10471b510923c29c75bacd0b7a58e247a0a9ce3005c23e0d3840807a24456d111b"
    },
    "resource": {
      "url": "https://api.example.com/premium-data",
      "description": "Access to premium market data",
      "mimeType": "application/json"
    },
    "accepted": {
      "scheme": "exact",
      "network": "eip155:84532",
      "amount": "10000",
      "asset": "0x036CbD53842c5426634e7929541eC2318f3dCF7e",
      "payTo": "0x70997970C51812dc3A010C7d01b50e0d17dc79C8",
      "maxTimeoutSeconds": 60,
      "extra": {
        "name": "USDC",
        "version": "2"
      }
    }
  },
  "context": {
    "verification_time": 1740672100
  },
  "expected": {
    "valid": false,
    "reason_code": "NOT_YET_VALID"
  }
}
