{
  "id": "x402-evm-eip3009-expired-001",
  "schema_version": "3.0.0",
  "protocol": "x402",
  "scheme": "exact",
  "network": "eip155:84532",
  "asset_transfer_method": "eip3009",
  "encodes": "Expired authorization: verification occurs at or after validBefore.",
  "provenance": [
    "EIP-3009"
  ],
  "description": "The baseline signature is unchanged. Verification occurs past the validity window, at or after validBefore, so the authorization is expired.",
  "input": {
    "x402Version": 2,
    "payload": {
      "authorization": {
        "from": "0xf39Fd6e51aad88F6F4ce6aB8827279cffFb92266",
        "to": "0x70997970C51812dc3A010C7d01b50e0d17dc79C8",
        "value": "10000",
        "validAfter": "1740672089",
        "validBefore": "1740672154",
        "nonce": "0xf3746613c2d920b5fdabc0856f2aeb2d4f88ee6037b8cc5d04a71a4462f13480"
      },
      "signature": "0x6f561d84da69dea3bf562f243b08ec7d3b6b140f7466c7c797d2a24554ed477b60b03719ddabe477324676e2ede73876c8ae62be1c0630b75bb5f050f48b21d71c"
    },
    "resource": {
      "url": "https://api.example.com/premium-data",
      "description": "Access to premium market data",
      "mimeType": "application/json"
    },
    "accepted": {
      "scheme": "exact",
      "network": "eip155:84532",
      "amount": "10000",
      "asset": "0x036CbD53842c5426634e7929541eC2318f3dCF7e",
      "payTo": "0x70997970C51812dc3A010C7d01b50e0d17dc79C8",
      "maxTimeoutSeconds": 60,
      "extra": {
        "name": "USDC",
        "version": "2"
      }
    }
  },
  "context": {
    "verification_time": 1740672200
  },
  "expected": {
    "valid": false,
    "reason_code": "EXPIRED"
  }
}
