{
  "id": "x402-evm-eip3009-amount-insufficient-001",
  "schema_version": "3.0.0",
  "protocol": "x402",
  "scheme": "exact",
  "network": "eip155:84532",
  "asset_transfer_method": "eip3009",
  "encodes": "Amount insufficient: the signed value is below the accepted amount.",
  "provenance": [
    "EIP-3009",
    "x402"
  ],
  "description": "The authorization authentically signs a value below the accepted amount, an authorized underpayment caught only after the signature is known genuine.",
  "input": {
    "x402Version": 2,
    "payload": {
      "authorization": {
        "from": "0xf39Fd6e51aad88F6F4ce6aB8827279cffFb92266",
        "to": "0x70997970C51812dc3A010C7d01b50e0d17dc79C8",
        "value": "9999",
        "validAfter": "1740672089",
        "validBefore": "1740672154",
        "nonce": "0x0303030303030303030303030303030303030303030303030303030303030303"
      },
      "signature": "0x27328664d2ad42fc02b3ee767ef413e6239afd665fd94aa115d0b9e949551c901224e0aecef200d95e8f8516956e91cee0a08cdf6450829d62381f5b635266351c"
    },
    "resource": {
      "url": "https://api.example.com/premium-data",
      "description": "Access to premium market data",
      "mimeType": "application/json"
    },
    "accepted": {
      "scheme": "exact",
      "network": "eip155:84532",
      "amount": "10000",
      "asset": "0x036CbD53842c5426634e7929541eC2318f3dCF7e",
      "payTo": "0x70997970C51812dc3A010C7d01b50e0d17dc79C8",
      "maxTimeoutSeconds": 60,
      "extra": {
        "name": "USDC",
        "version": "2"
      }
    }
  },
  "context": {
    "verification_time": 1740672100
  },
  "expected": {
    "valid": false,
    "reason_code": "AMOUNT_INSUFFICIENT"
  }
}
