{
  "id": "x402-evm-eip3009-domain-name-mismatch-001",
  "schema_version": "3.0.0",
  "protocol": "x402",
  "scheme": "exact",
  "network": "eip155:5042",
  "asset_transfer_method": "eip3009",
  "encodes": "EIP-712 domain name mismatch: signature bound to name \"USD Coin\" presented for a token whose domain name is \"USDC\".",
  "provenance": [
    "EIP-712",
    "EIP-3009",
    "CWE-347"
  ],
  "description": "The authorization was signed for Arc mainnet USDC (chainId 5042) under the EIP-712 domain name \"USD Coin\", the name Base mainnet USDC reports, while the Arc contract's name() is \"USDC\". Reconstructing the digest with the name from accepted.extra yields a recovered address that is not authorization.from.",
  "input": {
    "x402Version": 2,
    "payload": {
      "authorization": {
        "from": "0xf39Fd6e51aad88F6F4ce6aB8827279cffFb92266",
        "to": "0x70997970C51812dc3A010C7d01b50e0d17dc79C8",
        "value": "10000",
        "validAfter": "1740672089",
        "validBefore": "1740672154",
        "nonce": "0x0404040404040404040404040404040404040404040404040404040404040404"
      },
      "signature": "0xb82e461a54c0d6133e947b3ff1c2b8565db532fe92e2c20e8803eee463d91c7b5dda3ed0672c7a11afddd84a8f3acb59d8e60f12b0c94521459e479131e251261c"
    },
    "resource": {
      "url": "https://api.example.com/premium-data",
      "description": "Access to premium market data",
      "mimeType": "application/json"
    },
    "accepted": {
      "scheme": "exact",
      "network": "eip155:5042",
      "amount": "10000",
      "asset": "0x3600000000000000000000000000000000000000",
      "payTo": "0x70997970C51812dc3A010C7d01b50e0d17dc79C8",
      "maxTimeoutSeconds": 60,
      "extra": {
        "name": "USDC",
        "version": "2"
      }
    }
  },
  "context": {
    "verification_time": 1740672100
  },
  "expected": {
    "valid": false,
    "reason_code": "SIGNER_MISMATCH"
  }
}
