{
  "id": "x402-evm-eip3009-network-mismatch-001",
  "schema_version": "3.0.0",
  "protocol": "x402",
  "scheme": "exact",
  "network": "eip155:8453",
  "asset_transfer_method": "eip3009",
  "encodes": "Network mismatch: the target network differs from the accepted network.",
  "provenance": [
    "x402",
    "CAIP-2"
  ],
  "description": "The payment is accepted on eip155:84532 but the verifier's target network is eip155:8453. The plaintext mismatch is caught before any cryptography, while the signature itself is authentic.",
  "input": {
    "x402Version": 2,
    "payload": {
      "authorization": {
        "from": "0xf39Fd6e51aad88F6F4ce6aB8827279cffFb92266",
        "to": "0x70997970C51812dc3A010C7d01b50e0d17dc79C8",
        "value": "10000",
        "validAfter": "1740672089",
        "validBefore": "1740672154",
        "nonce": "0x0101010101010101010101010101010101010101010101010101010101010101"
      },
      "signature": "0x13e4e6b83168096278da7d426c281a65adc0754fe92405b865daec447d96764e5a54399c88d55f92bdaf2f7f0563f94d1b2c40d305476b2f5ef190cd7c0b252b1c"
    },
    "resource": {
      "url": "https://api.example.com/premium-data",
      "description": "Access to premium market data",
      "mimeType": "application/json"
    },
    "accepted": {
      "scheme": "exact",
      "network": "eip155:84532",
      "amount": "10000",
      "asset": "0x036CbD53842c5426634e7929541eC2318f3dCF7e",
      "payTo": "0x70997970C51812dc3A010C7d01b50e0d17dc79C8",
      "maxTimeoutSeconds": 60,
      "extra": {
        "name": "USDC",
        "version": "2"
      }
    }
  },
  "context": {
    "verification_time": 1740672100
  },
  "expected": {
    "valid": false,
    "reason_code": "NETWORK_MISMATCH"
  }
}
