{
  "id": "x402-evm-eip3009-cross-chain-replay-001",
  "schema_version": "3.0.0",
  "protocol": "x402",
  "scheme": "exact",
  "network": "eip155:84532",
  "asset_transfer_method": "eip3009",
  "encodes": "Cross-chain replay: signature bound to eip155:8453 presented to an eip155:84532 server.",
  "provenance": [
    "arXiv:2605.11781",
    "EIP-712",
    "EIP-3009",
    "CWE-294"
  ],
  "description": "The authorization was signed under the Base mainnet domain (chainId 8453) and is replayed against a Base Sepolia server. Reconstructing the digest with the target chainId yields a recovered address that is not authorization.from.",
  "input": {
    "x402Version": 2,
    "payload": {
      "authorization": {
        "from": "0xf39Fd6e51aad88F6F4ce6aB8827279cffFb92266",
        "to": "0x70997970C51812dc3A010C7d01b50e0d17dc79C8",
        "value": "10000",
        "validAfter": "1740672089",
        "validBefore": "1740672154",
        "nonce": "0xf3746613c2d920b5fdabc0856f2aeb2d4f88ee6037b8cc5d04a71a4462f13480"
      },
      "signature": "0xbf38fb328d535ba58158f457ec1ba494b1ad0f579960ec8bac6bde7e6a6381371e315305bb368b23a8946c65ee223b9968213823c823ebc3ffdf79984ad234481c"
    },
    "resource": {
      "url": "https://api.example.com/premium-data",
      "description": "Access to premium market data",
      "mimeType": "application/json"
    },
    "accepted": {
      "scheme": "exact",
      "network": "eip155:84532",
      "amount": "10000",
      "asset": "0x036CbD53842c5426634e7929541eC2318f3dCF7e",
      "payTo": "0x70997970C51812dc3A010C7d01b50e0d17dc79C8",
      "maxTimeoutSeconds": 60,
      "extra": {
        "name": "USDC",
        "version": "2"
      }
    }
  },
  "context": {
    "verification_time": 1740672100
  },
  "expected": {
    "valid": false,
    "reason_code": "SIGNER_MISMATCH"
  }
}
